{
  "cast": [
    {
      "adult": false,
      "gender": 2,
      "id": 22970,
      "known_for_department": "Acting",
      "name": "Peter Dinklage",
      "original_name": "Peter Dinklage",
      "popularity": 30.6,
      "profile_path": "/lRsRgnksAhBRXwAB68MFjmTtLrk.jpg",
      "character": "Tyrion Lannister",
      "credit_id": "5256c8b219c2956ff6047cd8",
      "order": 0
    }
  ],
  "crew": [
    {
      "department": "Directing",
      "job": "Director",
      "credit_id": "5256c8a219c2956ff6046e77",
      "adult": false,
      "gender": 2,
      "id": 44797,
      "known_for_department": "Directing",
      "name": "Timothy Van Patten",
      "original_name": "Timothy Van Patten",
      "popularity": 8.292,
      "profile_path": "/MzSOFrd99HRdr6pkSRSctk3kBR.jpg"
    }
  ],
  "guest_stars": [
    {
      "character": "Benjen Stark",
      "credit_id": "5256c8b919c2956ff604836a",
      "order": 62,
      "adult": false,
      "gender": 2,
      "id": 119783,
      "known_for_department": "Acting",
      "name": "Joseph Mawle",
      "original_name": "Joseph Mawle",
      "popularity": 8.559,
      "profile_path": "/1Ocb9v3h54beGVoJMm4w50UQhLf.jpg"
    }
  ],
  "id": 63056
}